item_id,description,profit_margin_2023,profit_percent_total
223,furminator short hair deshedding tools for dog,77400.0,0.014229836250346324
469,jaula bella peq. animalles,64686.0,0.011892392605812692
1061,simparica 40 mg  x 1 tab. 10,51200.0,0.009413018294802736
697,pidle place mazuri (baño perrito),38317.0,0.007044504335975712
553,zeus trailla dobl asa  xl  rojo 1,37770.0,0.0069439394725527214
1307,lw tunel peq. animales,34040.0,0.0062581863819352575
1763,habitrail twist kit,32721.0,0.006015690852035945
303,zd skull 2.0 leash large,31206.0,0.00573716111147684
121,zd bordeau ruff leash large,28192.0,0.0051830431985757566
1681,zd army green adjustable air mesh harness medium,28136.0,0.0051727477098158165
773,nm jfc stain & odor eliminator - trigger spray,27320.0,0.005022727730742397
1692,coastal style trailla brown paw m 1,25180.0,0.004629292981701815
838,lw. bola de ejercicio con base,23970.0,0.004406836885281672
755,jaula refugio hamster m,23804.0,0.004376318115028991
735,nm jfc pet block / repelente,22480.0,0.004132903345061827
998,"zeus trailla dobl asa ""xl"" grafito 1",21620.0,0.003974794053391312
1661,marina termocalefactor pre-set 100w -22c,21042.0,0.0038685299015476403
1474,pawise cama verde perros,20732.0,0.0038115370173408265
1436,habitrail ovo home azul,19770.0,0.003634675228286135
576,zeedog zee.pad grey 30 unid.,19380.0,0.0035629745029936923
1437,zd violet air-leash,19120.0,0.0035151740194653974
384,pack cuy  animal care,18385.0,0.003380045729491178
1432,body perro 0 verde,17988.0,0.0033070580681037426
1049,habitrail ovo suite,17332.0,0.0031864537712015827
894,afp classic felicy ardilla,17300.0,0.003180570634767331
745,zd army green handsfree leash,16683.0,0.003067136410394415
981,columbia leash small,16494.0,0.003032389135829616
853,zd hawkins stranger  adj. air mesh harness medium,16366.0,0.003008856590092609
1170,zd skull 2.0 harness + leash set,15740.0,0.00289376773359756
599,tetra aquasafe,15720.0,0.002890090773326153
284,zd volt adj. air mesh harness large,15480.0,0.002845967250069265
1346,catit filtro fuente acero inox 2 unid,15281.0,0.002809381495368762
796,zeedog salina h-harness large,15200.0,0.0027944898062695627
1471,fp atlas 10 / transportadora 48x32,14990.0,0.0027558817234197854
1244,do cinturon seguridad auto 25mmx55-87cm,14912.0,0.002741541578361297
720,zeedog mahalo collar medium,14632.0,0.0026900641345615943
812,lw small animal corta uña,14630.0,0.002689696438534454
501,repelente interiores perros-300ml,14562.0,0.002677194773611669
529,zd midnight adjustable air mesh harness medium,14532.0,0.0026716793332045583
372,padlock (my family),14148.0,0.0026010816959935374
609,nm urinen destroyer perro - quart,13990.0,0.0025720337098494197
1120,zeedog atlanta adjustable air mesh harness medium,13730.0,0.0025242332263211245
1540,catit rasguðador  banca ,13672.0,0.0025135700415340433
1490,vp mighty jr angry animals mad cow,12990.0,0.002388185696279054
392,bandeja sanit. gato l / betta,12850.0,0.0023624469743792026
566,zeedog neopro green leash small,12807.0,0.0023545415097956765
883,coastal style trailla resolve m 1,12590.0,0.0023146464908509073
1212,zeus trailla dobl asa  s  rojo 1,12580.0,0.002312808010715204
466,zd crimson air-leash,12535.0,0.002304534850104537
547,transportin avior,11897.0,0.002187239817446644
1221,zeedog atlanta collar large,11841.0,0.0021769443286867034
65,ps dental solutions starter kit,11824.0,0.0021738189124560067
1125,honey leash small,11689.800000000003,0.0021491465090348644
1503,zeedog atlanta h-harness medium,11406.0,0.002096970442783594
1630,habitrail retreat kit,11321.0,0.002081343361630113
967,naxpet 30 mg x 10 comp. raza gde.,11310.0,0.002079321033480839
829,zeedog nara adjustable air mesh harness small,11228.0,0.0020642454963680688
191,zeedog ella leash large,11144.0,0.002048802263228158
1349,le salon essential cepillo carda small,10992.0,0.0020208573651654626
1033,zeedog prisma leash large,10938.0,0.0020109295724326627
1312,zeedog gotham collar medium,10928.0,0.0020090910922969593
315,zeedog phantom h-harness large,10796.0,0.001984823154505671
927,sand leash large,10640.0,0.0019561428643886936
186,rueda de erizo/roedor,10550.0,0.0019395965431673607
285,zeedog finger puppets,10294.0,0.0018925314516933473
924,capa polar chiporro t/8 cata pets,10258.0,0.0018859129232048138
1041,lola h-harness medium,10092.0,0.0018553941529521334
560,nm 3in1 odor destroyer,9990.0,0.0018366416555679558
1633,tx arnes para auto s 30-60 cm,9708.0,0.0017847965157411125
1218,advantix 25-40 kg,9574.0,0.0017601608819226837
0,zeedog nara leash small,9402.0,0.0017285390235885806
1295,lw set arnes y correa peq animales  m ,9376.0,0.0017237589752357512
420,catit filtro fuente triple accion 2 un,9315.0,0.001712544246407959
728,sand adjustable air mesh harness large,9165.0,0.001684967044372404
717,dogti toallitas de limpieza ojos 70un,9092.0,0.001671546139381767
116,zeedog gotham h-harness small,8998.0,0.0016542644261061529
778,zeedog atlanta h-harness small,8910.0,0.0016380858009119607
109,zd smash leash large,8888.0,0.0016340411446134127
127,power ultra 11 - 20  kg,8805.0,0.001618781759487072
145,pawise arnes y cinturon de seguridad m,8704.0,0.0016002131101164653
1488,coastal lazer brite collar pink multi flowers l,8694.0,0.0015983746299807616
1489,le salon cortauñas alicate ergonomico,8648.0,0.001589917621356525
939,columbia leash large,8548.0,0.0015715328199994883
1152,coastal new earth collar de soya menta l,8534.0,0.001568958947809503
951,zeus trailla dobl asa  m  fucsia 1,8390.0,0.0015424848338553702
1651,zd neon coral h-harness extra small,8388.0,0.0015421171378282297
792,zd smash collar large,8378.0,0.001540278657692526
1219,small heart aluminum pink (my family),8288.0,0.001523732336471193
1319,zd cali dos air-leash,8263.0,0.001519136136131934
980,coastal k9 explorer arnes acolchado naranja s,8223.0,0.0015117822155891192
1520,coastal lazer brite trailla bones m,8139.0,0.0014963389824492086
730,collar cuero nº 5 (g. araya),8100.0,0.0014891689099199642
1429,parka impermeable talla 10,8084.0,0.0014862273417028385
982,ampolleta repti glo 5.0 tropical 26 w,8055.0,0.0014808957493092976
175,zd bordeau collar large,8046.0,0.0014792411171871643
765,coastal sublime collar purple xs,7947.0,0.0014610401638436982
1551,ladybug (my family),7660.0,0.0014082757839490032
1073,zeedog chroma leash extra small,7466.0,0.0013726092693163523
1350,honey collar medium,7436.799999999999,0.0013672409073200976
1055,red big circle paw (my family),7322.0,0.0013461351553622194
936,zeus collar semifijo  m  rojo,7280.0,0.0013384135387922642
589,cama zapato- mediano catapet,7191.0,0.0013220510655845017
356,zeedog neopro bubblegum leash large,7170.0,0.001318190257299524
1096,coastal maslow  plato pup verde 1596 ml,7076.0,0.0013009085440239096
626,coastal maslow  plato paw gris 1596 ml,6896.0,0.0012678159015812435
1000,afp litte buddy comforting gator,6486.0,0.0011924382160173935
401,coastal maslow plato dry ears gris 887 ml,6424.0,0.001181039639176031
1279,zeus trailla dobl asa  s  coral 1,6290.0,0.001156404005357602
142,zeedog ella collar extra small,6264.0,0.0011516239570047724
1249,zeedog mahalo adjustable air mesh harness medium,6158.0,0.0011321360675663136
1089,zd midnight leash small,6150.0,0.0011306652834577506
499,small bone aluminum purple (my family),5943.0,0.0010926087446486848
187,small bone chromed brass (my family),5862.0,0.0010777170555494853
1512,oat hay 425 gr,5794.0,0.0010652153906267005
470,brit care senior lamb & rice 3 kg,5674.0,0.0010431536289982565
684,zeus arnes fig.a  m  fucsia,5552.0,0.0010207241713426716
848,big heart aluminum black (my family),5454.0,0.0010027070660127758
1598,exo terra placa calefactora 8 w,5429.0,0.0009981108656735168
588,zeedog neon coral handsfree leash,5309.0,0.0009760491040450729
1643,collar cuero nº 4 (g. araya),5226.0,0.0009607897189187325
1607,dogit estaca de enganche manilla roja,5128.0,0.0009427726135888367
294,zd midnight collar small,4998.0,0.000918872371824689
229,big bone chromed brass (my family),4932.0,0.0009067384029290449
960,big round aluminum blue (my family),4848.0,0.0008912951697891342
371,zeedog mr. x,4811.0,0.0008844927932870306
683,purple big circle bone (my family),4764.0,0.0008758519366492233
873,zeedog prisma h-harness small,4694.0,0.0008629825756992977
790,zd ella adjustable air mesh harness extra small,4643.0,0.0008536063270072091
1338,"zeus collar ajustable ""l"" grafito",4524.0,0.0008317284133923357
1020,zeus bozal alpha  xs ,4444.0,0.0008170205723067064
530,collar cuero nº 3 ( g. araya),4362.0,0.0008019450351939362
262,dogit dispensador bolsa fecas rojo 2x20,4352.0,0.0008001065550582326
1749,toallitas neem,4324.0,0.0007949588106782625
696,zeedog mahalo adjustable air mesh harness small,4302.0,0.0007909141543797143
1660,mamadera  (kit) 59 ml.,4292.0,0.0007890756742440106
802,coastal sublime collar teal stripe l,4225.0,0.0007767578573347962
646,educador sanitario perro gato,4204.0,0.0007728970490498185
1495,pala sanitaria (granulos) negro,4185.0,0.0007694039367919815
1320,oftavet,4163.0,0.0007653592804934335
1500,coastal lazer brite trailla skulls s,4048.0,0.0007442167589328414
69,big heart aluminum red (my family),4044.0,0.0007434813668785599
567,collar cuero nº 6 (g. araya),3984.0,0.0007324504860643379
737,zd neon coral h-harness medium,3945.0,0.0007252804135350937
308,coastal style collar plaids,3944.0,0.0007250965655215233
1110,coastal lazer brite collar skulls s/m,3912.0,0.0007192134290872716
935,pawise bola luminosa 3,3890.0,0.0007151687727887235
94,arnes nacional mediano a. doctor,3736.0,0.0006868561786988872
421,cream chihuahua  (my family),3725.0,0.0006848338505496131
1340,dogit alfombrilla educadora  x-large 20u,3581.0,0.0006583597365954804
659,lw sustrato natural peq. anim. verde-10l,3496.0,0.0006427326554419993
1092,lm soother green for dog,3443.0,0.0006329887107227699
224,zeedog gotham air mesh plus harness extra small,3419.0,0.0006285763583970813
263,alfombrilla 14 unid,3358.0,0.0006173616295692889
1145,afp dog ultrasonic avestruz,3167.0,0.000582246658977349
760,coastal sublime collar flower pink s/m,3152.0,0.0005794889387737935
722,zeedog gotham bow-tie large,3004.0,0.0005522794327653793
1528,zeedog ella leash extra small,2937.0,0.0005399616158561648
1201,arnes gato colores g.a,2926.0,0.0005379392877068907
1310,zeedog skull h-harness extra small,2919.0,0.0005366523516118982
138,bozal clinico 4 (a. doctor),2864.0,0.0005265407108655282
1177,cadena cordon 2 mm a.doctor,2844.0,0.0005228637505941208
1076,noon collar extra small,2811.0,0.0005167967661462987
661,laser fun,2751.0,0.0005057658853320768
473,zeedog blu,2591.0,0.0004763502031608182
1339,afp lamb flying mouse,2524.0,0.0004640323862516037
1241,tx bozal con red incorporada s,2492.0,0.00045814924981735195
155,zeus arnes fig.a  s  coral,2492.0,0.00045814924981735195
603,zeus arnes fig.a  s  rojo,2460.0,0.0004522661133831002
679,vestido playero t-2,2448.0,0.0004500599372202558
1078,catnip crinkle&toss papers,2427.0,0.00044619912893527813
1266,le salon esse. corta uða alicate l/cat,2383.0,0.0004381098163381821
1444,big bone aluminum blue (my family),2379.0,0.0004373744242839006
552,clever pet bowl acero inox colores,2366.0,0.00043498440010748585
241,coastal style collar brown paw m,2272.0,0.0004177026868318714
325,cordon amarre 16 mm (corto) a. doctor,2241.0,0.0004120033984111901
1647,zeus collar ajustable  m  rojo,2202.0,0.00040483332588194584
759,zd neon coral collar extra small,2198.0,0.00040409793382766436
869,"gumi juguete hilo dental seda ""mini""",2162.0,0.00039747940533913124
713,zd skull 2.0 collar small,2137.0,0.00039288320499987207
1519,pawise hollow mono,2065.0,0.0003796461480228057
772,collar c/flor gde. a. doctor,2042.0,0.00037541764371068725
525,zeedog gotham collar small,2039.0,0.00037486609966997617
856,big round aluminum purple (my family),2033.0,0.000373763011588554
824,zeedog black bowl small,1934.0,0.00035556205824508776
486,collar c/flor  ch. a. doctor,1788.0,0.0003287202482638143
1299,zeus collar ajustable  m  coral,1730.0,0.0003180570634767331
100,"dogit cuerdas anudadas rosada ""s""",1644.0,0.00030224613430968164
1175,pawise elefante con tirador,1634.0,0.00030040765417397794
1672,pawise bozal tela s,1578.0,0.0002901121654140375
445,big round aluminum light blue (my family),1568.0,0.0002882736852783338
919,zeedog citrus bow-tie large,1521.0,0.0002796328286405266
259,pawise hollow buho,1502.0,0.00027613971638268967
1597,pawise little monster verde,1445.0,0.0002656603796091788
99,pawise meow life varita,1272.0,0.0002338546732615055
975,blister dispensador / bolsas fecas klint,1081.0,0.00019873970266956562
1160,viruta pino  800 gr,972.0,0.0001787002691903957
1463,l.w. comedero o bebedero gde 125 ml,897.0,0.00016491166817261826
293,collar cuero  nº1 (g. araya),0.0,0.0
1721,coche pet,0.0,0.0
1255,fancy feast terrine pollo 85 g,0.0,0.0
1353,brit care cat sterilized fillets healthy rabbit 85 g,0.0,0.0
766,monge all breeds adult rabbits 1x12 kg,0.0,0.0
955,dispensador small,0.0,0.0
1363,superpet gato omega,0.0,0.0
305,pro plan kitten 7,0.0,0.0
879,dog arnés negro,0.0,0.0
344,hartz jfc bizzy balls cat toy,0.0,0.0
459,kong wobbler cat small,0.0,0.0
1207,monge mini sen chicken 4x3 kg,0.0,0.0
742,pro plan kitten pollo pouch 85,0.0,0.0
13,nutram total grain-free trout & salmon meal dog food 11.4kg,0.0,0.0
367,bowl de plástico,0.0,0.0
78,brit care cat grain-free kitten healthy g&d 2 kg,0.0,0.0
1021,zeedog maze adjustable air mesh harness small,0.0,0.0
416,royal canin baby cat milk 300gr,0.0,0.0
1372,obt-td. cat - fish (2,0.0,0.0
1451,bowl 18 cm,0.0,0.0
1095,pro plan sensitive dog salmon y arroz lata 370 grs,0.0,0.0
817,rc mini adulto 8+ 1 kg,0.0,0.0
818,dispensador alimento maya / m (700 gr.),0.0,0.0
1638,kitten pouch 85gr,0.0,0.0
526,pro plan adult small breed 7,0.0,0.0
943,bravery chicken kitten 2 kg,0.0,0.0
413,pro plan active mind 7+ med lrg 3kg ar,0.0,0.0
1056,nutrience original adult cat 2.5 kg,0.0,0.0
1482,feline  k/d  lata x 156gr,0.0,0.0
450,zeedog gotham leash large,0.0,0.0
1390,zeedog ella collar medium,0.0,0.0
654,fcn urinary care 7.5kg,0.0,0.0
1685,royal can. obesity canine 1.5 kg.,0.0,0.0
1868,kit acuario,0.0,0.0
1028,comedero acero inox. con enganche,0.0,0.0
670,zd army green leash + harness set,0.0,0.0
1728,tx plato comida lenta ,0.0,0.0
1163,proplan active mind rzmedgrand 3kg,0.0,0.0
337,monge medium sen chicken de 3 kg,0.0,0.0
1,royal can. diabetic feline 1.5 kg.,0.0,0.0
1725,monge kitten  chicken de 1,0.0,0.0
1275,proplan sterilized cat 7.5 kilos,0.0,0.0
1397,brit pate & meat duck 400 gr,0.0,0.0
188,zd candy adj. air mesh harness large,0.0,0.0
1499,urinary care c/d hills 82 gr,0.0,0.0
556,royal can  early cardiac  canine 10 kilo,0.0,0.0
1509,poo bolsas compostables 60 u,0.0,0.0
645,pro plan sensitive skin m/l 15kg ar,0.0,0.0
562,zd smash h-harness small,0.0,0.0
1004,royal canin maxi adulto pouch 140 gr,0.0,0.0
464,royal canin intense hairball 1,0.0,0.0
233,monge sterilised  chicken de 1,0.0,0.0
161,english bulldog (my family),0.0,0.0
1766,bliss collar small,0.0,0.0
747,nutram sound balanced wellness puppy food 11.4kg,0.0,0.0
1370,obt-td. puppy s.bites - chicken (5,0.0,0.0
484,polerón con gorro rosado,0.0,0.0
1441,senses desing circuito rapido luminoso,0.0,0.0
1663,zeedof arnés ajustable morado,0.0,0.0
1659,royal canin gastrointestinal felino 1,0.0,0.0
647,royal can. shn. medium adult 15 kgr.,0.0,0.0
432,nutram total grain-free chicken & turkey dog food 2kg,0.0,0.0
1675,royal canin active 7+ 1.5kg,0.0,0.0
565,arnés adjustable cat ,0.0,0.0
1153,palace dog house,0.0,0.0
508,rc gatos cast. w.control 1,0.0,0.0
524,bravery lomo de atún y zanahoria,0.0,0.0
20,parka premium perro,0.0,0.0
1183,royal can fhn exigent  1.5 kilos,0.0,0.0
1082,pro plan adult cat 3kg ar,0.0,0.0
379,monge vs hepatic dog 2 kg,0.0,0.0
620,feline  i/d  lata x 156gr,0.0,0.0
688,royal mini junior  2.5 kg,0.0,0.0
140,royal can shn mini adulto 7,0.0,0.0
1399,amity sp low grain iberian pork adult 4 kg,0.0,0.0
461,royal canin yorkshire terrier 7,0.0,0.0
1862,habitat vertical ave,0.0,0.0
296,dogit paños humedos 40 unid,0.0,0.0
708,pro plan urinary cat 1kg ar,0.0,0.0
908,brit mono protein lamb 400 g,0.0,0.0
1616,royal can  hipoal diet canine 10 kilo,0.0,0.0
460,pro plan canine veterinary diets nf,0.0,0.0
1558,zeecat phantom collar,0.0,0.0
195,bravery lamb adult large/medium b. 12 kg,0.0,0.0
1641,pro plan adulto pollo pouch 100 gr,0.0,0.0
1765,igloo dog house,0.0,0.0
156,royal can. york. terrier junior 2.5 kgr.,0.0,0.0
1334,zeedog rob the microbe,0.0,0.0
1864,escalera de madera,0.0,0.0
937,catnip spray hierba gatera,0.0,0.0
1743,coastal luz para collar,0.0,0.0
1729,zeedog neopro green h-harness large,0.0,0.0
868,mebermic,0.0,0.0
875,hueso entretenido,0.0,0.0
1376,squeaky bounce ball large,0.0,0.0
1304,pro plan kitten pollo e higado lata 85 grs,0.0,0.0
174,pro plan adult cat 7+ 3kg ar,0.0,0.0
859,loft dog house,0.0,0.0
221,eukanuba adulto small breed 6.8 kg,0.0,0.0
54,afp lamb cuddle country animals,0.0,0.0
819,front range arnés naranjo,0.0,0.0
1188,brit care cat grain-free indoor anti-stress 7 kg,0.0,0.0
1657,royal can. vet cat  young male 1.5 kg.,0.0,0.0
1456,nutram sound kitten 1.13 kg,0.0,0.0
1018,brit care cat turkey pate with ham 70grs,0.0,0.0
1032,pro plan urinary cat 7,0.0,0.0
823,pro plan urinary cat carne y pollo lata 85 grs,0.0,0.0
1200,pro plan sterilized cat 3kg ar,0.0,0.0
1494,brit care gf puppy salmon 12 kg,0.0,0.0
1172,brit care cat kitten chicken 80 grs,0.0,0.0
83,proplan adulto dog pollo arroz  370grs,0.0,0.0
1395,bravery chicken puppy large/medium breeds 4 kg,0.0,0.0
1052,puzzle tornado nivel 2,0.0,0.0
667,nutrience original cat indoor 2,0.0,0.0
1600,pro plan feline veterinary diets ur,0.0,0.0
312,brit care cat indoor (monty) 2 kg,0.0,0.0
539,royal mini light 2.5kg,0.0,0.0
1323,royal can fhn light 40 7.5 kilo,0.0,0.0
1075,feline c/d multicare x lata 156 gr,0.0,0.0
1761,monge medium p&j chicken de 12 kg,0.0,0.0
1405,coastal sublime collar teal stripe s/m,0.0,0.0
605,capa impermeable azul,0.0,0.0
440,nath adulto maxi sabor pollo y arroz integral,0.0,0.0
1689,royal canin medium puppy pouch 140 gr,0.0,0.0
630,bravery chicken adult large/medium breeds 4 kg,0.0,0.0
1465,bravery light iberian pork adult large/medium breeds 12 kg,0.0,0.0
311,brit mono protein rabbit 400 gr,0.0,0.0
505,pro plan active mind 7+ med lrg 15kg ar,0.0,0.0
1511,nutram total grain free trout & salmon cat 1.13 kg,0.0,0.0
622,small round aluminum light blue  (my family),0.0,0.0
467,cama para perro negra zeedog,0.0,0.0
24,chaqueta chiporro verde ,0.0,0.0
579,brit care cat sterilised (missy)  2.0kg,0.0,0.0
66,royal can poodle puppy 3 kg,0.0,0.0
1128,bravery chicken adult cat,0.0,0.0
227,nutram total grain-free chicken & turkey cat food 1.13kg,0.0,0.0
222,simparica antiparasitario 80 mg,0.0,0.0
228,zeedog gotham leash extra small,0.0,0.0
1481,royal canin maxi puppy pouch 140 gr,0.0,0.0
1325,brit care gf puppy salmon 3 kg,0.0,0.0
1707,proplan adulto cat pollo y arroz 85gr,0.0,0.0
581,royal canin kitten sterilised 1.5 kg,0.0,0.0
442,vet diet urinary lp dog 2kg,0.0,0.0
1265,brit care gf senior & light salmon 12 kg,0.0,0.0
446,desparasitante bravecto para gatos,0.0,0.0
1711,royal recovery rs 145 grs. (lata),0.0,0.0
333,parka premium perro con chiporro,0.0,0.0
60,royal canin adulto maxi adult 15kg,0.0,0.0
92,proplan adulto cat alimento para gato,0.0,0.0
359,brit care cat grain-free sterilized sensitive 2 kg,0.0,0.0
364,plato gato doble redondo,0.0,0.0
724,nutrience orig kitten 2,0.0,0.0
899,"planet dog diamond plate double-tuff naranja ""s""",0.0,0.0
132,bravery iberian pork adult large/medium breeds 4 kg,0.0,0.0
983,royal can. hypoallergenic canine 2 kg.,0.0,0.0
248,comedero interactivo multi feeder,0.0,0.0
45,royal canin kitten 4 kg,0.0,0.0
1050,royal canin adulto mini adult 7,0.0,0.0
1053,siguimarina,0.0,0.0
72,royal can fhn kitten 36 400 grs,0.0,0.0
1240,poodle pouch 12x85g,0.0,0.0
318,royal can. vet cat senior s/o 1.5 kg.,0.0,0.0
238,royal canin mini adulto 2.5kg,0.0,0.0
1384,royal canin mini adulto  2 kg fr,0.0,0.0
12,brit care adult medium breed l&r 3 kg,0.0,0.0
258,pro plan gatos  esterilizados pollo pouch 85 gr,0.0,0.0
1625,royal can. vet cat young female 1.5 kg.,0.0,0.0
723,eukanuba adulto small breed 2,0.0,0.0
712,pro plan adult medium breed 15kg ar,0.0,0.0
1530,royal can. shn mini junior 1 kgr.,0.0,0.0
1139,royal canin feline hypoallergenic 1,0.0,0.0
569,pawise little monster rojo,0.0,0.0
1554,bravery iberian pork mini adult small breeds 7 kg,0.0,0.0
184,bravery chicken mini puppy small breeds 7 kg,0.0,0.0
271,pro plan feline veterinary diets nf advanced,0.0,0.0
555,dispensador alimento maya / s (200 gr.),0.0,0.0
1603,zd artsy adjustable air mesh harness small,0.0,0.0
1536,doguivit adulto,0.0,0.0
744,caña con pompones,0.0,0.0
1156,pro plan urinary cat 3kg ar,0.0,0.0
511,royal can. renal canine 2.0 kg.,0.0,0.0
15,small heart aluminum red (my family),0.0,0.0
1365,puzzle twister nivel 3,0.0,0.0
613,pro plan kitten pollo 85 gr pouch,0.0,0.0
809,nutrience infusion kitten 2,0.0,0.0
1753,fancy feast tartare trucha 85 g,0.0,0.0
35,bravery salmon mini adult small breeds 7 kg,0.0,0.0
920,brit care cat grain-free indoor anti-stress 2 kg,0.0,0.0
537,eukanuba puppy small breed 2  kg,0.0,0.0
1074,nutram sound adult senior cat 1.13 kg,0.0,0.0
517,royal can. shn mini junior 3 kgr.,0.0,0.0
185,pro plan feline veterinary diets nf early,0.0,0.0
151,royal canin gastrointestinal cat 1.5 kg,0.0,0.0
403,pawise bozal tela l,0.0,0.0
1779,eukanuba premium performance 18 kg ,0.0,0.0
1060,royal renal lp modified 385 grs. (lata),0.0,0.0
1068,simparica antiparasitario 40 mg,0.0,0.0
1624,kong extreme dental con cuerda,0.0,0.0
1321,collar expandible con hebilla negro,0.0,0.0
1445,canine l/d  lata x 370 gr,0.0,0.0
194,superpet perro adulto,0.0,0.0
350,pro plan exigent small breed 3kg ar,0.0,0.0
913,bravery chicken adult cat sterilized 7 kg,0.0,0.0
867,cama para perro azumpets,0.0,0.0
1435,pet woow dispensador de alimento,0.0,0.0
1045,royal can. babycat 34 2 kgr.,0.0,0.0
465,royal can. shn mini adulto 3 kgr.,0.0,0.0
225,royal canin baby cat intinctive  165grx6un,0.0,0.0
959,brit care cat grain-free sterilized weight control 7 kg,0.0,0.0
1002,brit care cat fillets in gravy with savory salmon 85 g,0.0,0.0
1712,royal canin hair skin care 1,0.0,0.0
1401,obt-g-free s.bites - duck (2,0.0,0.0
522,small heart aluminum black (my family),0.0,0.0
1169,adult instinctive pouch 85gr 12un,0.0,0.0
1726,pro plan reduced calorie m/l 15kg ar,0.0,0.0
604,zeedog mahalo leash extra small,0.0,0.0
58,repelente spray interior 300 ml,0.0,0.0
1424,royal can. shn. medium junior 15 kgr.,0.0,0.0
236,pro plan puppy small breed 7.5kg ar,0.0,0.0
977,alfombrilla de entrenamiento de cesped,0.0,0.0
61,nt total gf small breed trout & salmon meal dog food 2 kg,0.0,0.0
1626,shn mini adulto 8+ 2.5 kg,0.0,0.0
75,zeus trailla doble asa xl azul denim 1.2m,0.0,0.0
734,nutrience infusion cat adulto 2,0.0,0.0
976,zeus arnes fig.a  m  coral,0.0,0.0
1386,rodillo quitapelos y pelusas,0.0,0.0
1364,monge medium adult chicken 12 kg,0.0,0.0
1526,pro plan canine veterinary diets en,0.0,0.0
396,intense beauty pouch 85gr 12un,0.0,0.0
1328,royal gastrointestinal felino 165 grs. (lata),0.0,0.0
119,torre árbol con casa gatos premium,0.0,0.0
559,royal canin baby dog milk 400gr,0.0,0.0
1165,fhn fit 32 1.5kg,0.0,0.0
1673,nutram sound balanced wellness puppy food 2kg,0.0,0.0
655,proplan puppy pollo y arroz 370grs,0.0,0.0
310,zeus trailla dobl asa  xl  coral 1,0.0,0.0
991,royal renal lp mod. 170 grs. (lata),0.0,0.0
1214,royal canin  feline hepatic 1.5kg,0.0,0.0
1865,juguete columpio de colores para aves,0.0,0.0
199,royal canin poodle adulto 3 kg,0.0,0.0
1296,royal can fhn indoor 7.5 kg,0.0,0.0
789,hueso masticable con textura,0.0,0.0
904,zd hawkins stranger  leash large,0.0,0.0
651,zd candy collar large,0.0,0.0
1644,proplan adulto latas,0.0,0.0
515,obt-g-free cat - chicken (2,0.0,0.0
1039,small bone aluminum black (my family),0.0,0.0
1756,zeedog skull collar small,0.0,0.0
1752,polerón con gorro verde,0.0,0.0
1664,brit care cat senior (angel)  2 kg,0.0,0.0
1514,brit care gf junior large breed salmon  3 kg,0.0,0.0
